product_id,page,category_id,manufacturer_id,titre,titre_it_auto,affiliate_links,description,description_it_auto,image_paths,name,name_it_auto,description_short,description_short_it_auto,meta_title,meta_title_it_auto,meta_description,meta_description_it_auto,youtube_url
1005007712400433,1,1,1,Bafang 500W EBike Kit Rear Drive Wheel Hub Motor Electric Bike Brushless Motor Bicycle Conversion Kit 20Ah 17.5Ah 13Ah Battery,"Kit bici elettrica Bafang da 500 W, motore del mozzo della ruota posteriore, motore brushless per bici elettrica, kit di conversione per bicicletta, batteria da 20 Ah, 17,5 Ah e 13 Ah.",https://s.click.aliexpress.com/e/_c4cJzvxB,"<h3>Features</h3><p>The Bafang 500W Ebike Kit is a comprehensive solution for converting your bicycle into an electric bike. This powerful rear drive wheel hub motor offers smooth and reliable assistance, making hills and long distances a breeze.</p><ul> <li><strong>Powerful 500W Motor:</strong> Experience impressive acceleration and climbing ability with the high-torque brushless motor.</li> <li>Rear Drive Hub Motor: </li> <li>Multiple Battery Options: Available in 20Ah, 17.5Ah, and 13Ah capacities to suit your riding needs and distance requirements.</li></ul><h3>Specifications</h3><p>The Bafang Ebike Kit is engineered with precision for optimal performance and durability.</p><ul> <li>Motor Power: 500W</li> <li>Battery Capacity Options: 20Ah, 17.5Ah, 13Ah</li> <li>Motor Type: Brushless Hub Motor </li> <li>Drive System: Rear Drive</li></ul><h3>Benefits</h3><p>Transform your cycling experience with the benefits of this powerful ebike kit.</p><ul> <li>Effortless Riding: Conquer hills and long distances with ease, reducing physical strain.</li> <li>Increased Range: Choose from multiple battery capacities to extend your riding range. </li> <li>Environmentally Friendly: Enjoy a sustainable mode of transportation by reducing reliance on gasoline-powered vehicles.</li></ul><h3>Usage</h3><p>The Bafang Ebike Kit is designed for easy installation and use. It integrates seamlessly with most bicycle frames, allowing you to enjoy the benefits of electric assistance quickly and conveniently.</p>","<h3>Caratteristiche</h3><p>Il kit Bafang 500W Ebike è una soluzione completa per trasformare la tua bicicletta in una bici elettrica. Questo potente motore del mozzo della ruota posteriore offre un'assistenza fluida e affidabile, rendendo le colline e le lunghe distanze un gioco da ragazzi.</p><ul> <li><strong>Potente motore da 500 W:</strong> sperimenta un'accelerazione e una capacità di salita impressionanti con il motore brushless ad alta coppia.</li> <li>Motore del mozzo posteriore:</li> <li>Diverse opzioni di batteria: disponibile con capacità di 20 Ah, 17,5 Ah e 13 Ah per soddisfare le tue esigenze di guida e i requisiti di distanza.</li></ul><h3>Specifiche</h3><p>Il kit Bafang Ebike è progettato con precisione per prestazioni e durata ottimali.</p><ul> <li>Potenza del motore: 500 W</li> <li>Opzioni di capacità della batteria: 20 Ah, 17,5 Ah, 13 Ah</li> <li>Tipo di motore: motore del mozzo brushless</li> <li>Sistema di trasmissione: posteriore Guida</li></ul><h3>Vantaggi</h3><p>Trasforma la tua esperienza ciclistica con i vantaggi di questo potente kit per bici elettrica.</p><ul> <li>Guida senza sforzo: conquista colline e lunghe distanze con facilità, riducendo lo sforzo fisico.</li> <li>Autonomia aumentata: scegli tra diverse capacità della batteria per estendere l'autonomia di guida.</li> <li>Rispettoso dell'ambiente: goditi un mezzo di trasporto sostenibile riducendo la dipendenza dai veicoli a benzina.</li></ul><h3>Utilizzo</h3><p>Il kit per bici elettrica Bafang è progettato per una facile installazione e utilizzo. Si integra perfettamente con la maggior parte dei telai di biciclette, consentendoti di godere dei vantaggi dell'assistenza elettrica in modo rapido e comodo.</p>",/Users/terrybauer/Documents/site affiliation/bafang/APPLI:SCRIPT aliexpress/APP IMPORT ALIEXPRESS/images/1005007712400433/image_1.webp|/Users/terrybauer/Documents/site affiliation/bafang/APPLI:SCRIPT aliexpress/APP IMPORT ALIEXPRESS/images/1005007712400433/image_2.webp|/Users/terrybauer/Documents/site affiliation/bafang/APPLI:SCRIPT aliexpress/APP IMPORT ALIEXPRESS/images/1005007712400433/image_3.webp|/Users/terrybauer/Documents/site affiliation/bafang/APPLI:SCRIPT aliexpress/APP IMPORT ALIEXPRESS/images/1005007712400433/image_4.webp|/Users/terrybauer/Documents/site affiliation/bafang/APPLI:SCRIPT aliexpress/APP IMPORT ALIEXPRESS/images/1005007712400433/image_5.webp|/Users/terrybauer/Documents/site affiliation/bafang/APPLI:SCRIPT aliexpress/APP IMPORT ALIEXPRESS/images/1005007712400433/image_6.webp,"BAFANG 500W Ebike Kit Rear Drive Wheel Hub Motor Electric Bicycle Brushless Motor Conversion Kit, 20Ah/13Ah Battery","Kit bici elettrica BAFANG da 500 W, motore del mozzo della ruota posteriore, kit di conversione motore brushless per bicicletta elettrica, batteria da 20 Ah/13 Ah","<p>Unleash your inner explorer with the Bafang 500W Ebike Kit! This powerful rear drive wheel hub motor transforms any bicycle into a smooth, efficient electric bike.</p><p>Designed for riders seeking exhilarating adventures and effortless commutes, this kit delivers exceptional performance. Experience the thrill of a <strong style=""font-weight: bold;"">brushless motor</strong> that boasts 500 watts of power, effortlessly tackling hills and cruising on flat terrain. </p><ul> <li><strong>Choose Your Power Pack:</strong> Available with 20Ah, 17.5Ah, or 13Ah battery options to suit your riding needs.</li> <li>Effortless Pedal Assist: Enjoy seamless integration with your pedaling, allowing you to customize your level of assistance.</li> <li>Durable and Reliable: Built with high-quality components for a long-lasting and dependable ebike conversion.</li></ul><p>With its robust construction and cutting-edge technology, the Bafang 500W Ebike Kit empowers you to explore new horizons, conquer challenging terrain, and enjoy the freedom of electric biking. <em>Embrace the future of cycling!</em></p>","<p>Scatena l'esploratore che è in te con il kit Bafang Ebike da 500 W! Questo potente motore con mozzo posteriore trasforma qualsiasi bicicletta in una bici elettrica fluida ed efficiente.</p><p>Progettato per i ciclisti che cercano avventure entusiasmanti e spostamenti senza sforzo, questo kit offre prestazioni eccezionali. Prova l'emozione di un <strong style=""font-weight: bold;"">motore brushless</strong> che vanta 500 watt di potenza, affrontando senza sforzo le salite e navigando su terreni pianeggianti. </p><ul> <li><strong>Scegli il tuo Power Pack:</strong> disponibile con batterie da 20 Ah, 17,5 Ah o 13 Ah per soddisfare le tue esigenze di guida.</li> <li>Pedalazione assistita senza sforzo: goditi un'integrazione perfetta con la tua pedalata, che ti consente di personalizzare il livello di assistenza.</li> <li>Resistente e affidabile: realizzato con componenti di alta qualità per una conversione ebike duratura e affidabile.</li></ul><p>Con la sua struttura robusta e la tecnologia all'avanguardia, il kit ebike Bafang da 500 W ti consente di esplorare nuovi orizzonti, conquistare terreni impegnativi e goderti la libertà della bici elettrica. <em>Abbraccia il futuro del ciclismo!</em></p>",Bafang 500W E-Bike Conversion Kit | Powerful Rear Drive Motor,Kit di conversione per bici elettrica Bafang da 500 W | Potente motore di trazione posteriore,"Power up your rides with the Bafang 500W E-Bike Conversion Kit, featuring a powerful rear drive hub motor and long-lasting battery options for effortless cycling.","Potenzia le tue pedalate con il kit di conversione per bici elettrica Bafang da 500 W, dotato di un potente motore nel mozzo posteriore e di batterie a lunga durata per pedalare senza sforzo.",
1005010179573118,1,1,1,Bafang 48V 750W 500W Front Rear Wheel Hub Motor Brushless Gear Drive Electric Bike Conversion Kit 20 26 27.5 29 Inch 700C Kits,"Kit di conversione per bici elettrica Bafang 48V 750W 500W con motore del mozzo della ruota anteriore e posteriore, trasmissione a ingranaggi senza spazzole, 20, 26, 27,5, 29 pollici, kit 700C",https://s.click.aliexpress.com/e/_c4M86K8z,"<h3>Features</h3><p>This Bafang electric bike conversion kit is your ticket to effortless riding and exhilarating adventures. It's designed for a seamless integration into your existing bicycle, transforming it into a powerful e-bike with impressive performance.</p><ul> <li><strong>Brushless Gear Drive Motor:</strong> Experience smooth and efficient power delivery with the brushless gear drive motor. This motor type is renowned for its quiet operation and long lifespan.</li> <li>Dual Configuration Options: </h3> <ul> <li>Front Wheel Hub Motor:</li> <li>Rear Wheel Hub Motor:</li> </ul> </li> <li><strong>Wide Tire Compatibility:</strong> Suitable for a range of wheel sizes, including 20"", 26"", 27.5"", 29"", and 700C.</li></ul><h3>Specifications</h3><p>Powering your journey are the following specifications:</p><ul> <li>Voltage: 48V</li> <li>Motor Power Output: Up to 750W (peak power) / 500W (continuous power)</li></ul><h3>Benefits</h3><p>This Bafang conversion kit unlocks a world of benefits:</p><ul> <li><strong>Effortless Hills and Headwinds:</strong> Conquer any terrain with ease thanks to the powerful motor that assists your pedaling.</li> <li>Increased Range: Extend your riding distance compared to traditional bicycles, allowing you to explore further.</li> <li>Enjoyable Commuting: Make your daily commute more efficient and less strenuous.</li> <li>Fun for All Riders: Add an element of adventure and excitement to your cycling experiences.</li></ul><h3>Usage</h3><p>The kit is designed for installation on a compatible bicycle. The Bafang electric bike conversion kit will provide you with the necessary components, including the motor, controller, throttle, display, and wiring harness. Installation may require some basic mechanical skills and tools. It is recommended to consult the manufacturer's instructions and seek professional assistance if needed.</p>","<h3>Caratteristiche</h3><p>Questo kit di conversione per bici elettrica Bafang è il tuo biglietto d'ingresso per una guida senza sforzo e avventure entusiasmanti. È progettato per una perfetta integrazione con la tua bicicletta, trasformandola in una potente e-bike dalle prestazioni impressionanti.</p><ul> <li><strong>Motore brushless con trasmissione a ingranaggi:</strong> Sperimenta un'erogazione di potenza fluida ed efficiente con il motore brushless con trasmissione a ingranaggi. Questo tipo di motore è rinomato per il suo funzionamento silenzioso e la lunga durata.</li> <li>Opzioni di doppia configurazione:</h3> <ul> <li>Motore del mozzo della ruota anteriore:</li> <li>Motore del mozzo della ruota posteriore:</li> </ul> </li> <li><strong>Compatibilità con pneumatici larghi:</strong> Adatto a una gamma di dimensioni di ruote, tra cui 20"", 26"", 27,5"", 29"" e 700C.</li></ul><h3>Specifiche</h3><p>Le seguenti specifiche alimentano il tuo viaggio:</p><ul> <li>Tensione: 48 V</li> <li>Potenza del motore: fino a 750 W (potenza di picco) / 500 W (potenza continua)</li></ul><h3>Vantaggi</h3><p>Questo kit di conversione Bafang apre le porte a un mondo di vantaggi:</p><ul> <li><strong>Salite senza sforzo e Vento contrario:</strong> conquista qualsiasi terreno con facilità grazie al potente motore che assiste la pedalata.</li> <li>Autonomia aumentata: aumenta la distanza percorsa rispetto alle biciclette tradizionali, permettendoti di esplorare più a fondo.</li> <li>Trasferimenti quotidiani più piacevoli: rendi i tuoi spostamenti quotidiani più efficienti e meno faticosi.</li> <li>Divertimento per tutti i ciclisti: aggiungi un tocco di avventura ed entusiasmo alle tue esperienze in bicicletta.</li></ul><h3>Utilizzo</h3><p>Il kit è progettato per l'installazione su una bicicletta compatibile. Il kit di conversione per bici elettrica Bafang ti fornirà i componenti necessari, inclusi motore, controller, acceleratore, display e cablaggio. L'installazione potrebbe richiedere alcune competenze meccaniche di base e attrezzi. Si consiglia di consultare le istruzioni del produttore e di rivolgersi a un professionista, se necessario.</p>",/Users/terrybauer/Documents/site affiliation/bafang/APPLI:SCRIPT aliexpress/APP IMPORT ALIEXPRESS/images/1005010179573118/image_1.webp|/Users/terrybauer/Documents/site affiliation/bafang/APPLI:SCRIPT aliexpress/APP IMPORT ALIEXPRESS/images/1005010179573118/image_2.webp|/Users/terrybauer/Documents/site affiliation/bafang/APPLI:SCRIPT aliexpress/APP IMPORT ALIEXPRESS/images/1005010179573118/image_3.webp|/Users/terrybauer/Documents/site affiliation/bafang/APPLI:SCRIPT aliexpress/APP IMPORT ALIEXPRESS/images/1005010179573118/image_4.webp|/Users/terrybauer/Documents/site affiliation/bafang/APPLI:SCRIPT aliexpress/APP IMPORT ALIEXPRESS/images/1005010179573118/image_5.webp|/Users/terrybauer/Documents/site affiliation/bafang/APPLI:SCRIPT aliexpress/APP IMPORT ALIEXPRESS/images/1005010179573118/image_6.webp,"BAFANG 48V 750W / 500W Front/Rear Wheel Hub Motor Brushless Gear Drive E-Bike Conversion Kit for 20, 26, 29"" & 700C Wheels","Kit di conversione per bici elettrica con motore brushless per mozzo ruota anteriore/posteriore BAFANG 48V 750W/500W per ruote da 20, 26, 29"" e 700C","<p>Experience the thrill of effortless riding with the Bafang 48V 750W (500W) Front/Rear Wheel Hub Motor Brushless Gear Drive Electric Bike Conversion Kit. This powerful kit transforms your existing bike into a high-performance e-bike, opening up a world of possibilities for commuting, exploring, or simply enjoying the ride.</p> <p>Designed with versatility in mind, this conversion kit is compatible with a wide range of wheel sizes: 20, 26, 27.5, and 29 inches, as well as 700C. </p><ul> <li><strong>Powerful Performance:</strong> The Bafang 750W (500W) brushless motor delivers exceptional torque and speed, making hills a breeze and effortless acceleration a reality.</li> <li><strong>Smooth & Efficient:</strong> The gear drive system ensures smooth and efficient power delivery, extending your range and maximizing battery life.</li> <li><em>Customizable Installation:</em> Choose between front or rear wheel hub motor placement based on your preference and riding style.</li></ul><p>Upgrade your cycling experience today with the Bafang 48V Electric Bike Conversion Kit where power, versatility, and performance converge.</p>","<p>Prova l'emozione di una guida senza sforzo con il kit di conversione per bici elettrica Bafang con motore brushless nel mozzo della ruota anteriore/posteriore da 48 V e 750 W (500 W). Questo potente kit trasforma la tua bici attuale in una e-bike ad alte prestazioni, aprendo un mondo di possibilità per il pendolarismo, l'esplorazione o semplicemente per goderti il ​​viaggio.</p> <p>Progettato pensando alla versatilità, questo kit di conversione è compatibile con un'ampia gamma di dimensioni di ruote: 20, 26, 27,5 e 29 pollici, nonché 700C. </p><ul> <li><strong>Prestazioni potenti:</strong> il motore brushless Bafang da 750 W (500 W) offre coppia e velocità eccezionali, rendendo le salite un gioco da ragazzi e l'accelerazione senza sforzo una realtà.</li> <li><strong>Fluido ed efficiente:</strong> il sistema di trasmissione a ingranaggi garantisce un'erogazione di potenza fluida ed efficiente, estendendo l'autonomia e massimizzando la durata della batteria.</li> <li><em>Installazione personalizzabile:</em> scegli tra il posizionamento del motore sul mozzo della ruota anteriore o posteriore in base alle tue preferenze e al tuo stile di guida.</li></ul><p>Migliora la tua esperienza ciclistica oggi stesso con il kit di conversione per bici elettrica Bafang da 48 V, dove potenza, versatilità e prestazioni convergono.</p>","Powerful Bafang E-Bike Conversion Kit: 48V, 750W Motor",Potente kit di conversione per bici elettrica Bafang: motore da 48 V e 750 W,"Elevate your biking experience with the Bafang 48V 750W electric bike conversion kit, featuring a powerful brushless gear drive motor for effortless climbs and increased range on 20-29 inch wheels.","Migliora la tua esperienza in bici con il kit di conversione per bici elettrica Bafang 48V 750W, dotato di un potente motore brushless con trasmissione a ingranaggi per salite senza sforzo e una maggiore autonomia su ruote da 20-29 pollici.",https://www.youtube.com/watch?v=waGG3zFdhMM
1005008039738649,1,1,1,Bafang 36V 48V 500W BBS02B Mid Drive Motor Bike Electric Bicycle Conversion Kits 8fun M315 Fit for BB Size 68mm-73mm 44T,Kit di conversione per bicicletta elettrica Bafang BBS02B Mid Drive Motor 36V 48V 500W 8fun M315 adatto per dimensioni BB 68mm-73mm 44T,https://s.click.aliexpress.com/e/_c4PtG2SZ,"<h3>Features</h3><p>The Bafang BBS02B mid drive motor is a powerful and versatile option for converting your bicycle into an electric bike. This kit boasts a robust design, making it perfect for tackling hills and long distances.</p><ul><li><strong>High-Torque Output:</strong> The 500W motor provides ample power to assist you on climbs and maintain speed effortlessly.</li><li>Variable Speed Levels: </li> Choose from multiple assist levels to customize your riding experience based on terrain and personal preference.</li><li>Smooth & Quiet Operation: </li>The integrated planetary gear system delivers quiet and efficient power transmission, minimizing noise and vibration.</li><li>Compact Design: The mid-drive motor placement maintains a natural riding feel and is compatible with a wide range of bicycle frames.</li></ul><h3>Specifications</h3><p>This Bafang electric bike conversion kit comes equipped with various components designed for optimal performance.</p><ul><li>Voltage: 36V or 48V (selection available)</li><li>Motor Power: 500W</li><li>Chainring Size: 44T</li><li>Bottom Bracket Shell Size: 68mm - 73mm (compatible with standard BB sizes) </li><li>Crank Arm Compatibility: 8fun M315</li></ul><h3>Benefits</h3><p>Transform your bicycle into a powerful and efficient electric bike with the Bafang BBS02B conversion kit. Experience the freedom of effortless riding, conquer hills with ease, and enjoy extended range on your cycling adventures.</p><ul><li><strong>Effortless Riding:</strong> The motor's assistance reduces physical strain and makes cycling more enjoyable, even on challenging terrain.</li><li>Increased Range: Extend your cycling distance by utilizing the electric assist to supplement your pedaling power.</li><li>Enhanced Performance: Tackle hills with confidence thanks to the high-torque output of the 500W motor.</li></ul><h3>Usage</h3><p>Installing this Bafang BBS02B kit requires basic mechanical skills and knowledge. Follow the included instructions carefully for a successful conversion process.</p><p>Once installed, simply engage the assist levels using the provided controller to customize your riding experience. The system seamlessly integrates with your existing bicycle components, providing a smooth and natural feel while pedaling. </p>","<h3>Caratteristiche</h3><p>Il motore centrale Bafang BBS02B è un'opzione potente e versatile per trasformare la tua bicicletta in una bici elettrica. Questo kit vanta un design robusto, che lo rende perfetto per affrontare salite e lunghe distanze.</p><ul><li><strong>Coppia elevata:</strong> il motore da 500 W fornisce una potenza sufficiente per assisterti in salita e mantenere la velocità senza sforzo.</li><li>Livelli di velocità variabili:</li> scegli tra diversi livelli di assistenza per personalizzare la tua esperienza di guida in base al terreno e alle preferenze personali.</li><li>Funzionamento fluido e silenzioso:</li> il sistema di ingranaggi planetari integrato offre una trasmissione di potenza silenziosa ed efficiente, riducendo al minimo rumore e vibrazioni.</li><li>Design compatto: il posizionamento del motore centrale mantiene una sensazione di guida naturale ed è compatibile con un'ampia gamma di telai di biciclette.</li></ul><h3>Specifiche</h3><p>Questo kit di conversione per bici elettrica Bafang è dotato di vari componenti progettati per prestazioni ottimali.</p><ul><li>Tensione: 36 V o 48 V (selezione disponibile)</li><li>Potenza del motore: 500W</li><li>Dimensioni corona: 44T</li><li>Dimensioni scatola movimento centrale: 68 mm - 73 mm (compatibile con le dimensioni standard del movimento centrale)</li><li>Compatibilità pedivella: 8fun M315</li></ul><h3>Vantaggi</h3><p>Trasforma la tua bicicletta in una bici elettrica potente ed efficiente con il kit di conversione Bafang BBS02B. Prova la libertà di una pedalata senza sforzo, conquista le salite con facilità e goditi un'autonomia maggiore nelle tue avventure in bicicletta.</p><ul><li><strong>Guida senza sforzo:</strong> l'assistenza del motore riduce lo sforzo fisico e rende la pedalata più piacevole, anche su terreni impegnativi.</li><li>Autonomia aumentata: aumenta la distanza percorsa utilizzando l'assistenza elettrica per integrare la potenza della pedalata.</li><li>Prestazioni migliorate: affronta le salite con sicurezza grazie all'elevata coppia erogata dal motore da 500 W.</li></ul><h3>Utilizzo</h3><p>L'installazione di questo kit Bafang BBS02B richiede competenze e conoscenze meccaniche di base. Segui attentamente le istruzioni incluse per un processo di conversione di successo.</p><p>Una volta installato, è sufficiente attivare i livelli di assistenza utilizzando il controller in dotazione per personalizzare la propria esperienza di guida. Il sistema si integra perfettamente con i componenti della bicicletta esistenti, offrendo una sensazione di pedalata fluida e naturale.</p>",/Users/terrybauer/Documents/site affiliation/bafang/APPLI:SCRIPT aliexpress/APP IMPORT ALIEXPRESS/images/1005008039738649/image_1.webp|/Users/terrybauer/Documents/site affiliation/bafang/APPLI:SCRIPT aliexpress/APP IMPORT ALIEXPRESS/images/1005008039738649/image_2.webp|/Users/terrybauer/Documents/site affiliation/bafang/APPLI:SCRIPT aliexpress/APP IMPORT ALIEXPRESS/images/1005008039738649/image_3.webp|/Users/terrybauer/Documents/site affiliation/bafang/APPLI:SCRIPT aliexpress/APP IMPORT ALIEXPRESS/images/1005008039738649/image_4.webp|/Users/terrybauer/Documents/site affiliation/bafang/APPLI:SCRIPT aliexpress/APP IMPORT ALIEXPRESS/images/1005008039738649/image_5.webp|/Users/terrybauer/Documents/site affiliation/bafang/APPLI:SCRIPT aliexpress/APP IMPORT ALIEXPRESS/images/1005008039738649/image_6.webp,"BAFANG BBS02B Mid Drive Motor Kit 36V/48V 500W Electric Bicycle Conversion with 8FUN M315 Chainring, Fits BB Size 68mm-73mm, 44T","Kit motore centrale BAFANG BBS02B 36V/48V 500W per conversione bicicletta elettrica con corona 8FUN M315, adatto per dimensioni BB 68mm-73mm, 44T","<p>Experience the thrill of effortless cycling with the Bafang BBS02B Mid Drive Motor Kit. This powerful 500W motor seamlessly integrates into your bike, transforming it into an electric powerhouse.</p><p>Choose between 36V or 48V configurations to match your riding style and terrain demands. The robust <strong>mid-drive design</strong> delivers exceptional torque and responsiveness, making hills a breeze and providing a smooth, natural feel while pedaling.</p><ul> <li><strong>Compatible with BB Size: 68mm-73mm</strong> - Ensures a perfect fit for most bike frames.</li> <li>Equipped with the <strong>8fun M315 Crankset</strong> for optimal performance and durability.</li></ul><p>The Bafang BBS02B is more than just a motor; it's an upgrade to your cycling experience. Enjoy increased range, effortless uphill climbs, and a whole new level of riding pleasure with this versatile electric conversion kit.</p>","<p>Prova l'emozione di pedalare senza sforzo con il kit motore centrale Bafang BBS02B. Questo potente motore da 500 W si integra perfettamente nella tua bici, trasformandola in una vera e propria centrale elettrica.</p><p>Scegli tra configurazioni da 36 V o 48 V in base al tuo stile di guida e alle esigenze del terreno. Il robusto <strong>design centrale</strong> offre coppia e reattività eccezionali, rendendo le salite un gioco da ragazzi e offrendo una sensazione di pedalata fluida e naturale.</p><ul> <li><strong>Compatibile con dimensioni del movimento centrale: 68 mm-73 mm</strong> - Garantisce una perfetta aderenza alla maggior parte dei telai.</li> <li>Dotato di <strong>guarnitura 8fun M315</strong> per prestazioni e durata ottimali.</li></ul><p>Il Bafang BBS02B è più di un semplice motore: è un miglioramento della tua esperienza ciclistica. Goditi una maggiore autonomia, salite senza sforzo e un livello completamente nuovo di piacere di guida con questo versatile kit di conversione elettrica.</p>",Powerful Bafang BBS02B Mid Drive Ebike Conversion Kit,Potente kit di conversione per bici elettrica Bafang BBS02B Mid Drive,"Upgrade your bike with the Bafang BBS02B mid-drive motor kit, featuring a powerful 500W motor, compatible with various bikes and offering smooth, efficient electric assistance.","Aggiorna la tua bici con il kit motore centrale Bafang BBS02B, dotato di un potente motore da 500 W, compatibile con diverse bici e che offre un'assistenza elettrica fluida ed efficiente.",https://www.youtube.com/watch?v=WUHWjUOKXc8
