product_id,page,category_id,manufacturer_id,titre,titre_it_auto,affiliate_links,description,description_it_auto,image_paths,name,name_it_auto,description_short,description_short_it_auto,meta_title,meta_title_it_auto,meta_description,meta_description_it_auto,youtube_url
1005010177557259,1,1,1,Bafang 750W 500W 48V Front Rear Hub Motor Ebike Conversion Kit Bafang Brushless Rear Wheel Motor Bicycle Electric Bike Kits,Kit di conversione per bici elettrica Bafang 750W 500W 48V con motore anteriore e posteriore Bafang Brushless per ruota posteriore Kit per bici elettrica,https://s.click.aliexpress.com/e/_c4Vvoaxx,"<h3>Features</h3><p>The Bafang 750W/500W 48V Front Rear Hub Motor E-Bike Conversion Kit is a versatile and powerful system designed to transform your bicycle into an electric bike. With its robust motor options, this kit offers both speed and torque for an exhilarating riding experience.</p><ul> <li><strong>Dual Motor Options:</strong> Choose between a 750W or 500W rear hub motor, offering varying levels of power for different riding needs.</li> <li>Powerful Brushless Motor: </li> Experience smooth and quiet operation with the brushless motor technology. <li>48V System Voltage: </li> Provides ample energy for efficient performance and longer ranges.</li></ul><h3>Specifications</h3><p>This Bafang conversion kit is built to deliver reliable performance. While specific technical details like weight and airflow may vary, the system is designed with quality components to ensure durability and longevity.</p> <h3>Benefits</h3><p>Converting your bicycle into an electric bike unlocks a world of possibilities:</p><ul> <li>Effortless Commuting: </li> Tackle hills and long distances with ease, making your daily commute more enjoyable. <li>Enhanced Adventure: </li> Explore new trails and terrains with the added power at your disposal.</li> <li>Eco-Friendly Option:</li> Reduce your carbon footprint by choosing an electric bike over traditional gasoline-powered vehicles.</li></ul><h3>Usage</h3><p>The Bafang 750W/500W 48V Front Rear Hub Motor E-Bike Conversion Kit is designed for installation on compatible bicycles. It typically involves replacing your existing rear wheel with the conversion kit's motor and integrating the battery, controller, and throttle into your bike's frame.</p><p>For a successful installation, it's recommended to consult the provided instructions or seek assistance from an experienced bicycle mechanic familiar with e-bike conversions. </p>","<h3>Caratteristiche</h3><p>Il kit di conversione per bici elettrica Bafang 750W/500W 48V con motore anteriore e posteriore è un sistema versatile e potente progettato per trasformare la tua bicicletta in una bici elettrica. Grazie alle sue robuste opzioni di motore, questo kit offre sia velocità che coppia per un'esperienza di guida esaltante.</p><ul> <li><strong>Opzioni doppio motore:</strong> scegli tra un motore da 750W o 500W con motore posteriore, offrendo diversi livelli di potenza per diverse esigenze di guida.</li> <li>Potente motore brushless:</li> sperimenta un funzionamento fluido e silenzioso con la tecnologia del motore brushless. <li>Tensione di sistema a 48V:</li> fornisce energia in abbondanza per prestazioni efficienti e maggiori autonomie.</li></ul><h3>Specifiche</h3><p>Questo kit di conversione Bafang è progettato per offrire prestazioni affidabili. Sebbene dettagli tecnici specifici come peso e flusso d'aria possano variare, il sistema è progettato con componenti di qualità per garantire durata e longevità.</p> <h3>Vantaggi</h3><p>Convertire la tua bicicletta in una bici elettrica apre un mondo di possibilità:</p><ul> <li>Trasferimento senza sforzo: </li> Affronta colline e lunghe distanze con facilità, rendendo il tuo tragitto quotidiano più piacevole. <li>Avventura migliorata: </li> Esplora nuovi sentieri e terreni con la potenza aggiuntiva a tua disposizione.</li> <li>Opzione ecologica:</li> Riduci la tua impronta di carbonio scegliendo una bici elettrica rispetto ai tradizionali veicoli a benzina.</li></ul><h3>Utilizzo</h3><p>Il kit di conversione per bici elettrica con motore nel mozzo anteriore e posteriore Bafang da 750 W/500 W e 48 V è progettato per l'installazione su biciclette compatibili. In genere, comporta la sostituzione della ruota posteriore esistente con il motore del kit di conversione e l'integrazione della batteria, del controller e dell'acceleratore nel telaio della bici.</p><p>Per un'installazione corretta, si consiglia di consultare le istruzioni fornite o di chiedere assistenza a un meccanico di biciclette esperto in conversioni di bici elettriche.</p>",/Users/terrybauer/Documents/site affiliation/bafang/APPLI:SCRIPT aliexpress/APP IMPORT ALIEXPRESS/images/1005010177557259/image_1.webp|/Users/terrybauer/Documents/site affiliation/bafang/APPLI:SCRIPT aliexpress/APP IMPORT ALIEXPRESS/images/1005010177557259/image_2.webp|/Users/terrybauer/Documents/site affiliation/bafang/APPLI:SCRIPT aliexpress/APP IMPORT ALIEXPRESS/images/1005010177557259/image_3.webp|/Users/terrybauer/Documents/site affiliation/bafang/APPLI:SCRIPT aliexpress/APP IMPORT ALIEXPRESS/images/1005010177557259/image_4.webp|/Users/terrybauer/Documents/site affiliation/bafang/APPLI:SCRIPT aliexpress/APP IMPORT ALIEXPRESS/images/1005010177557259/image_5.webp|/Users/terrybauer/Documents/site affiliation/bafang/APPLI:SCRIPT aliexpress/APP IMPORT ALIEXPRESS/images/1005010177557259/image_6.webp,BAFANG 750W/500W 48V Front/Rear Hub Motor E-Bike Conversion Kit Brushless Rear Wheel Motor Let me know if you need help with any other product titles!,Kit di conversione per bici elettrica con motore del mozzo anteriore/posteriore BAFANG 750W/500W 48V Motore della ruota posteriore senza spazzole Fammi sapere se hai bisogno di aiuto con altri titoli di prodotti!,"<p>Elevate your cycling experience with the Bafang 750W/500W 48V Front or Rear Hub Motor Ebike Conversion Kit. This powerful and versatile kit seamlessly transforms your bicycle into a robust electric bike, ready to conquer any terrain.</p><p>Harnessing the strength of a <strong>brushless motor</strong>, this kit delivers exhilarating performance with smooth acceleration and impressive climbing capabilities. Choose from either a front or rear hub motor configuration to perfectly suit your riding style and preferences.</p><ul> <li>750W peak power output for conquering hills and demanding rides</li> <li>Efficient 500W continuous power delivery for seamless pedaling assistance</li> <li>48V system voltage for optimal performance and range</li> <li>Sleek and durable hub motor design for reliable operation</li></ul><p>Experience the freedom and efficiency of electric cycling with the Bafang Conversion Kit. Empower your adventures and enjoy effortless journeys.</p>","<p>Migliora la tua esperienza ciclistica con il kit di conversione per bici elettrica Bafang con motore nel mozzo anteriore o posteriore da 750W/500W e 48V. Questo kit potente e versatile trasforma la tua bicicletta in una robusta bici elettrica, pronta a conquistare qualsiasi terreno.</p><p>Sfruttando la potenza di un <strong>motore brushless</strong>, questo kit offre prestazioni esaltanti con un'accelerazione fluida e capacità di salita impressionanti. Scegli tra la configurazione del motore nel mozzo anteriore o posteriore per adattarla perfettamente al tuo stile di guida e alle tue preferenze.</p><ul> <li>Potenza di picco di 750W per conquistare salite e percorsi impegnativi</li> <li>Efficiente erogazione di potenza continua da 500W per un'assistenza alla pedalata fluida</li> <li>Tensione di sistema a 48V per prestazioni e autonomia ottimali</li> <li>Design elegante e resistente del motore nel mozzo per un funzionamento affidabile</li></ul><p>Scopri la libertà e l'efficienza del ciclismo elettrico con il kit di conversione Bafang. Dai sfogo alle tue avventure e goditi viaggi senza sforzo.</p>",Bafang Hub Motor E-Bike Conversion Kit | Powerful & Reliable,Kit di conversione per bici elettrica con motore Bafang Hub | Potente e affidabile,"Boost your bike's performance with the Bafang conversion kit, featuring a powerful 750W/500W brushless motor for thrilling rides and effortless climbs.","Migliora le prestazioni della tua bici con il kit di conversione Bafang, dotato di un potente motore brushless da 750W/500W per pedalate emozionanti e salite senza sforzo.",
1005007295225923,1,1,1,BAFANG Mid Drive Motor 1000W 750W 500W 250W 350W Electric Bike Conversion Kit BBSHD BBS02B BBS01B M615 M325 M215 Ebike Kits,Kit di conversione per bici elettrica BAFANG Mid Drive Motor 1000W 750W 500W 250W 350W BBSHD BBS02B BBS01B M615 M325 M215,https://s.click.aliexpress.com/e/_c4rfPnNT,"<h3>Features</h3><p>The BAFANG Mid Drive Motor Conversion Kit is your key to transforming your bicycle into a powerful electric bike. This versatile kit comes in various power options, allowing you to choose the perfect level of assistance for your needs.</p><ul><li><strong>Powerful Mid-Drive Motor:</strong> Experience smooth and efficient power delivery with the BAFANG mid-drive motor, known for its exceptional torque and performance. </li><li>Multiple Power Options: 1000W, 750W, 500W, 250W, and 350W options provide you with a range of choices to match your riding style and requirements.</li><li>Wide Compatibility: Designed to fit various standard bicycle frames, this kit is ideal for converting existing bikes into e-bikes. </li><li>Durable Construction: Built with high-quality components, the BAFANG kit is engineered for long-lasting performance and reliability.</li></ul><h3>Specifications</h3><p>Choose the power output that best suits your needs from the options available.</p><h3>Benefits</h3><p>Transform your bicycle into a versatile e-bike with the BAFANG Mid Drive Motor Conversion Kit. Enjoy an enhanced riding experience with powerful assistance, extended range, and effortless hill climbing.</p><ul><li><strong>Effortless Cycling: </strong> The electric assist makes riding easier, especially on inclines or long distances.</li><li>Increased Range: Extend your cycling adventures by supplementing your pedaling power with the motor's assistance.</li> <li>Enhanced Performance: Experience improved acceleration and top speed for a more exhilarating ride.</li></ul><h3>Usage</h3><p>Install the BAFANG kit according to the provided instructions. Once installed, simply use the included display unit to select your desired power level and enjoy your transformed e-bike! Remember to charge the battery regularly to ensure optimal performance.</p>","<h3>Caratteristiche</h3><p>Il kit di conversione motore centrale BAFANG è la chiave per trasformare la tua bicicletta in una potente bici elettrica. Questo versatile kit è disponibile in diverse opzioni di potenza, consentendoti di scegliere il livello di assistenza perfetto per le tue esigenze.</p><ul><li><strong>Potente motore centrale:</strong> sperimenta un'erogazione di potenza fluida ed efficiente con il motore centrale BAFANG, noto per la sua coppia e le sue prestazioni eccezionali. </li><li>Diverse opzioni di potenza: le opzioni da 1000 W, 750 W, 500 W, 250 W e 350 W ti offrono una gamma di opzioni per soddisfare il tuo stile di guida e le tue esigenze.</li><li>Ampia compatibilità: progettato per adattarsi a diversi telai di biciclette standard, questo kit è ideale per convertire le bici esistenti in e-bike. </li><li>Costruzione durevole: realizzato con componenti di alta qualità, il kit BAFANG è progettato per prestazioni e affidabilità di lunga durata.</li></ul><h3>Specifiche</h3><p>Scegli la potenza più adatta alle tue esigenze tra le opzioni disponibili.</p><h3>Vantaggi</h3><p>Trasforma la tua bicicletta in una versatile e-bike con il kit di conversione del motore centrale BAFANG. Goditi un'esperienza di guida migliorata con una potente assistenza, un'autonomia estesa e una salita senza sforzo.</p><ul><li><strong>Ciclismo senza sforzo: </strong> l'assistenza elettrica semplifica la pedalata, soprattutto in salita o sulle lunghe distanze.</li><li>Autonomia aumentata: prolunga le tue avventure in bicicletta integrando la potenza della pedalata con l'assistenza del motore.</li> <li>Prestazioni migliorate: sperimenta un'accelerazione e una velocità massima migliorate per una guida più esaltante.</li></ul><h3>Utilizzo</h3><p>Installa il kit BAFANG secondo le istruzioni fornite. Una volta installata, è sufficiente utilizzare il display incluso per selezionare il livello di potenza desiderato e godersi la propria e-bike trasformata! Ricordarsi di caricare la batteria regolarmente per garantire prestazioni ottimali.</p>",/Users/terrybauer/Documents/site affiliation/bafang/APPLI:SCRIPT aliexpress/APP IMPORT ALIEXPRESS/images/1005007295225923/image_1.webp|/Users/terrybauer/Documents/site affiliation/bafang/APPLI:SCRIPT aliexpress/APP IMPORT ALIEXPRESS/images/1005007295225923/image_2.webp|/Users/terrybauer/Documents/site affiliation/bafang/APPLI:SCRIPT aliexpress/APP IMPORT ALIEXPRESS/images/1005007295225923/image_3.webp|/Users/terrybauer/Documents/site affiliation/bafang/APPLI:SCRIPT aliexpress/APP IMPORT ALIEXPRESS/images/1005007295225923/image_4.webp|/Users/terrybauer/Documents/site affiliation/bafang/APPLI:SCRIPT aliexpress/APP IMPORT ALIEXPRESS/images/1005007295225923/image_5.webp|/Users/terrybauer/Documents/site affiliation/bafang/APPLI:SCRIPT aliexpress/APP IMPORT ALIEXPRESS/images/1005007295225923/image_6.webp,BAFANG Mid Drive Motor Electric Bike Conversion Kit 1000W/750W/500W/250W/350W BBSHD BBS02B BBS01B M615 M325 M215,Kit di conversione per bici elettrica con motore centrale BAFANG 1000W/750W/500W/250W/350W BBSHD BBS02B BBS01B M615 M325 M215,"<p><strong>Elevate your cycling experience with the BAFANG Mid Drive Motor Conversion Kit.</strong> This powerful system seamlessly integrates into your existing bicycle, transforming it into an electric bike that conquers hills and long distances with ease.</p> <p>Choose from a range of wattage options 1000W, 750W, 500W, 250W, or 350W to match your needs and riding style. The mid-drive motor design provides exceptional torque and efficiency, delivering smooth and responsive power delivery.</p><ul> <li><strong>Powerful Mid-Drive Motor:</strong> Experience superior torque and smooth acceleration for effortless uphill climbs and cruising on flat terrain.</li> <li><strong>Multiple Wattage Options:</strong> Customize your riding experience with a range of powerful motors to suit your needs.</li> <li>Easy Installation: </h3> The BAFANG Conversion Kit is designed for straightforward installation, allowing you to upgrade your bike with minimal effort.</li></ul> <p>The BAFANG Mid Drive Motor Conversion Kit offers an affordable and reliable solution for enhancing your cycling adventures. Enjoy longer rides, increased efficiency, and a whole new level of riding enjoyment with the power of electric assistance at your fingertips.</p>","<p><strong>Migliora la tua esperienza ciclistica con il kit di conversione del motore centrale BAFANG.</strong> Questo potente sistema si integra perfettamente nella tua bicicletta, trasformandola in una bici elettrica che conquista facilmente colline e lunghe distanze.</p> <p>Scegli tra una gamma di opzioni di potenza da 1000 W, 750 W, 500 W, 250 W o 350 W per soddisfare le tue esigenze e il tuo stile di guida. Il design del motore centrale offre coppia ed efficienza eccezionali, offrendo un'erogazione di potenza fluida e reattiva.</p><ul> <li><strong>Potente motore centrale:</strong> sperimenta una coppia superiore e un'accelerazione fluida per affrontare salite senza sforzo e pedalare su terreni pianeggianti.</li> <li><strong>Diverse opzioni di potenza:</strong> personalizza la tua esperienza di guida con una gamma di motori potenti adatti alle tue esigenze.</li> <li>Installazione semplice:</h3> il kit di conversione BAFANG è progettato per un'installazione semplice, consentendoti di aggiornare la tua bici con il minimo sforzo.</li></ul> <p>Il kit di conversione del motore centrale BAFANG offre una soluzione conveniente e affidabile per migliorare le tue avventure in bicicletta. Goditi pedalate più lunghe, maggiore efficienza e un livello completamente nuovo di piacere di guida con la potenza dell'assistenza elettrica a portata di mano.</p>",BAFANG Mid Drive Motor Kits: Powerful E-Bike Conversions,Kit motore centrale BAFANG: potenti conversioni per bici elettriche,"Upgrade your bike with a powerful and reliable BAFANG mid-drive motor kit, offering various wattages for enhanced performance and effortless cycling.","Aggiorna la tua bici con un potente e affidabile kit motore centrale BAFANG, che offre vari wattaggi per prestazioni migliorate e una pedalata senza sforzo.",
1005010143022860,1,1,1,Gear Shift Sensor for Bafang BBS01/02B BBSHD Electric Bike Sensor Sensor for Electric Bicycle Mid Drive System Shift Cable 3 PIN,Sensore di cambio marcia per Bafang BBS01/02B BBSHD Sensore per bici elettrica Sensore per sistema di trasmissione centrale per bicicletta elettrica Cavo del cambio a 3 PIN,https://s.click.aliexpress.com/e/_c4lYjmMH,"<h3>Features</h3><p>This Gear Shift Sensor is designed specifically for Bafang BBS01/02B and BBSHD mid-drive electric bike systems. It seamlessly integrates with your existing setup, ensuring accurate gear position detection for optimal performance.</p><ul> <li>Compatible with 3-pin shift cables</li> <li>Precisely detects gear changes for smooth power delivery</li> <li>Enhances riding experience by providing responsive and accurate assistance</li></ul><h3>Specifications</h3><p>This Gear Shift Sensor is engineered to meet the demands of electric bike systems. It features robust construction and reliable performance.</p><ul> <li>Compatible with Bafang BBS01/02B and BBSHD motors</li> <li>Utilizes a 3-pin connector for secure and stable connection</li></ul><h3>Benefits</h3><p>By incorporating this Gear Shift Sensor into your electric bike setup, you unlock several key benefits:</p><ul> <li><strong>Improved Riding Experience:</strong> Precise gear detection ensures seamless power transfer, providing a smoother and more responsive ride.</li> <li><strong>Optimized Performance:</strong> The sensor accurately communicates with the motor to deliver appropriate assistance based on your chosen gear, maximizing efficiency and power output.</li> <li><strong>Enhanced Safety:</strong> Accurate gear sensing contributes to safer riding by ensuring the motor's output aligns with your current gear selection.</li></ul><h3>Usage</h3><p>Installing this Gear Shift Sensor is straightforward. Connect the sensor to the 3-pin connector on your Bafang BBS01/02B or BBSHD motor and ensure it is securely attached to the shift cable mechanism. After installation, calibrate the sensor according to the instructions provided with your electric bike system.</p><p>This Gear Shift Sensor plays a vital role in ensuring optimal performance and safety for your Bafang mid-drive electric bike. By accurately detecting gear changes, it allows for smooth power delivery and enhances your overall riding experience.</p>","<h3>Caratteristiche</h3><p>Questo sensore di cambio marcia è progettato specificamente per i sistemi di bici elettriche a trazione centrale Bafang BBS01/02B e BBSHD. Si integra perfettamente con la configurazione esistente, garantendo un rilevamento accurato della posizione del cambio per prestazioni ottimali.</p><ul> <li>Compatibile con cavi del cambio a 3 pin</li> <li>Rileva con precisione i cambi di marcia per un'erogazione di potenza fluida</li> <li>Migliora l'esperienza di guida fornendo un'assistenza reattiva e precisa</li></ul><h3>Specifiche</h3><p>Questo sensore di cambio marcia è progettato per soddisfare le esigenze dei sistemi di bici elettriche. Presenta una struttura robusta e prestazioni affidabili.</p><ul> <li>Compatibile con i motori Bafang BBS01/02B e BBSHD</li> <li>Utilizza un connettore a 3 pin per una connessione sicura e stabile</li></ul><h3>Vantaggi</h3><p>Integrando questo sensore di cambio marcia nella configurazione della tua bici elettrica, otterrai diversi vantaggi chiave:</p><ul> <li><strong>Esperienza di guida migliorata:</strong> il rilevamento preciso della marcia garantisce un trasferimento di potenza fluido, offrendo una guida più fluida e reattiva.</li> <li><strong>Prestazioni ottimizzate:</strong> il sensore comunica accuratamente con il motore per fornire l'assistenza appropriata in base alla marcia scelta, massimizzando l'efficienza e la potenza in uscita.</li> <li><strong>Sicurezza migliorata:</strong> il rilevamento preciso della marcia contribuisce a una guida più sicura assicurando che l'uscita del motore sia allineata con la marcia selezionata al momento.</li></ul><h3>Utilizzo</h3><p>L'installazione di questo sensore di cambio marcia è semplice. Collega il sensore al connettore a 3 pin del tuo motore Bafang BBS01/02B o BBSHD e assicurati che sia saldamente fissato al meccanismo del cavo del cambio. Dopo l'installazione, calibra il sensore secondo le istruzioni fornite con il sistema della tua bici elettrica.</p><p>Questo sensore di cambio marcia svolge un ruolo fondamentale nel garantire prestazioni e sicurezza ottimali per la tua bici elettrica Bafang a trazione centrale. Rilevando con precisione i cambi di marcia, consente un'erogazione di potenza fluida e migliora la tua esperienza di guida complessiva.</p>",/Users/terrybauer/Documents/site affiliation/bafang/APPLI:SCRIPT aliexpress/APP IMPORT ALIEXPRESS/images/1005010143022860/image_1.webp|/Users/terrybauer/Documents/site affiliation/bafang/APPLI:SCRIPT aliexpress/APP IMPORT ALIEXPRESS/images/1005010143022860/image_2.webp|/Users/terrybauer/Documents/site affiliation/bafang/APPLI:SCRIPT aliexpress/APP IMPORT ALIEXPRESS/images/1005010143022860/image_3.webp|/Users/terrybauer/Documents/site affiliation/bafang/APPLI:SCRIPT aliexpress/APP IMPORT ALIEXPRESS/images/1005010143022860/image_4.webp|/Users/terrybauer/Documents/site affiliation/bafang/APPLI:SCRIPT aliexpress/APP IMPORT ALIEXPRESS/images/1005010143022860/image_5.webp|/Users/terrybauer/Documents/site affiliation/bafang/APPLI:SCRIPT aliexpress/APP IMPORT ALIEXPRESS/images/1005010143022860/image_6.webp,"BAFANG Gear Shift Sensor for BBS01/02B, BBSHD Electric Bikes - Mid Drive System Shift Cable (3 PIN)","Sensore di cambio marcia BAFANG per bici elettriche BBS01/02B, BBSHD - Cavo cambio sistema di trasmissione centrale (3 PIN)","<p>Take control of your electric bike's power with our precise Gear Shift Sensor, designed specifically for Bafang BBS01/02B and BBSHD mid-drive systems. Seamlessly integrate this sensor into your e-bike setup to enjoy optimal performance and efficiency.</p><p>This 3-pin sensor utilizes a shift cable connection, ensuring smooth and responsive communication between your gears and motor. Experience the difference of perfectly matched power delivery for each gear position.</p><ul><li><strong>Compatible with Bafang BBS01/02B and BBSHD Motors</strong> - Designed to work flawlessly with your existing system.</li><li>3-Pin Connector - Provides a reliable connection for accurate signal transmission.</li><li>Shift Cable Integration - Ensures smooth gear changes and precise power delivery.</li></ul><p>Upgrade your electric bike's functionality and riding experience with our Gear Shift Sensor. Conquer hills with ease and enjoy a smoother, more efficient ride every time.</p>","<p>Prendi il controllo della potenza della tua bici elettrica con il nostro preciso sensore di cambio, progettato specificamente per i sistemi di trasmissione centrale Bafang BBS01/02B e BBSHD. Integra perfettamente questo sensore nella configurazione della tua e-bike per godere di prestazioni ed efficienza ottimali.</p><p>Questo sensore a 3 pin utilizza una connessione tramite cavo del cambio, garantendo una comunicazione fluida e reattiva tra le marce e il motore. Scopri la differenza di un'erogazione di potenza perfettamente sincronizzata per ogni posizione di marcia.</p><ul><li><strong>Compatibile con i motori Bafang BBS01/02B e BBSHD</strong> - Progettato per funzionare perfettamente con il tuo sistema esistente.</li><li>Connettore a 3 pin - Fornisce una connessione affidabile per una trasmissione accurata del segnale.</li><li>Integrazione del cavo del cambio - Garantisce cambi di marcia fluidi e un'erogazione di potenza precisa.</li></ul><p>Migliora le funzionalità e l'esperienza di guida della tua bici elettrica con il nostro sensore di cambio. Conquista le salite con facilità e goditi una guida più fluida ed efficiente ogni volta.</p>",Bafang BBS01/02B Gear Shift Sensor for E-Bikes,Sensore di cambio marcia Bafang BBS01/02B per bici elettriche,"Maintain smooth gear shifting with our precision Gear Shift Sensor, designed specifically for Bafang BBS01/02B and BBSHD electric bike mid-drive systems.","Mantieni un cambio marcia fluido con il nostro sensore di cambio marcia di precisione, progettato specificamente per i sistemi di trasmissione centrale delle bici elettriche Bafang BBS01/02B e BBSHD.",
