product_id,page,category_id,manufacturer_id,titre,titre_it_auto,affiliate_links,description,description_it_auto,image_paths,name,name_it_auto,description_short,description_short_it_auto,meta_title,meta_title_it_auto,meta_description,meta_description_it_auto,youtube_url
1005007958094145,1,1,1,EBike Display SW102T LCD Screen Display 0-5 levels for BAFANG BBS01B BBS02B BBSHD Mid Motor Ebike Computer with PAS UART Protoco,Display EBike SW102T Schermo LCD Display 0-5 livelli per BAFANG BBS01B BBS02B BBSHD Mid Motor Ebike Computer con protocollo PAS UART,https://s.click.aliexpress.com/e/_c3qiqRLB,"<h3>Features</h3><p>The EBike Display SW102T is a comprehensive LCD screen display designed specifically for BAFANG mid-drive electric bike motors, including the BBS01B, BBS02B, and BBSHD models. This user-friendly display provides essential information about your ride, allowing you to monitor and adjust your eBike's performance with ease.</p><ul><li><strong>Integrated 5-Level PAS (Pedal Assist Sensor) Control:</strong> Fine-tune your level of assistance with five distinct PAS settings, ranging from subtle support to powerful boost.</li><li>Bright LCD Screen: Enjoy clear visibility even in challenging lighting conditions with the bright and easily readable LCD display.</li><li>UART Protocol Compatibility: The SW102T seamlessly integrates with BAFANG motors via the UART protocol, ensuring reliable data transfer and communication.</li><li>Intuitive User Interface: Navigate through menus and settings effortlessly with the straightforward and intuitive user interface.</li></ul><h3>Specifications</h3><p>The SW102T LCD display is crafted to meet the demanding requirements of eBike systems. </p><ul><li><strong>Display Type:</strong> LCD</li><li><strong>Screen Size: </strong> Compact and easy-to-view</li><li><strong>PAS Levels: </strong> 5 adjustable levels</li><li><strong>Connectivity: </strong> UART Protocol for seamless communication with BAFANG motors</li><li><strong>Mounting Options: </strong> Designed for secure mounting on your eBike handlebar.</li></ul><h3>Benefits</h3><p>The EBike Display SW102T offers a multitude of benefits to enhance your eBike riding experience:</p><ul><li><b>Personalized Ride Control:</b> Tailor your eBike's power output to match your desired level of assistance, whether you prefer gentle support or powerful acceleration.</li><li><b>Enhanced Safety and Visibility:</b> The bright LCD screen ensures easy readability in various lighting conditions, allowing for greater situational awareness during your rides.</li><li><b>Seamless Integration: </b> The SW102T seamlessly integrates with BAFANG motors through the UART protocol, ensuring smooth data exchange and reliable performance.</li><li><b>User-Friendly Operation:</b> The intuitive user interface makes navigating menus and settings a breeze, allowing for quick and effortless adjustments.</li></ul><h3>Usage</h3><p>The SW102T is designed to be easily integrated into your BAFANG-powered eBike. Simply mount the display securely on your handlebars and connect it to your motor using the provided UART cable. Use the intuitive buttons on the display to cycle through menus, adjust PAS levels, and monitor essential riding information such as speed, battery level, and distance.</p> <p>Regularly check your eBike's battery level and ensure proper charging to optimize performance. Consult the user manual for detailed instructions and safety guidelines specific to your BAFANG motor system.</p>","<h3>Caratteristiche</h3><p>L'EBike Display SW102T è un display LCD completo progettato specificamente per i motori per bici elettriche a trazione centrale BAFANG, inclusi i modelli BBS01B, BBS02B e BBSHD. Questo display intuitivo fornisce informazioni essenziali sulla tua corsa, consentendoti di monitorare e regolare facilmente le prestazioni della tua eBike.</p><ul><li><strong>Controllo PAS (sensore di assistenza alla pedalata) integrato a 5 livelli:</strong> regola con precisione il livello di assistenza con cinque distinte impostazioni PAS, che vanno da un supporto delicato a una potente spinta.</li><li>Schermo LCD luminoso: goditi una visibilità nitida anche in condizioni di illuminazione difficili grazie al display LCD luminoso e facilmente leggibile.</li><li>Compatibilità con il protocollo UART: SW102T si integra perfettamente con i motori BAFANG tramite il protocollo UART, garantendo un trasferimento dati e una comunicazione affidabili.</li><li>Interfaccia utente intuitiva: naviga tra i menu e le impostazioni senza sforzo grazie all'interfaccia utente semplice e intuitiva.</li></ul><h3>Specifiche</h3><p>Il display LCD SW102T è progettato per soddisfare i severi requisiti dei sistemi eBike. </p><ul><li><strong>Tipo di display:</strong> LCD</li><li><strong>Dimensioni dello schermo:</strong> Compatto e facile da visualizzare</li><li><strong>Livelli PAS:</strong> 5 livelli regolabili</li><li><strong>Connettività:</strong> Protocollo UART per una comunicazione fluida con i motori BAFANG</li><li><strong>Opzioni di montaggio:</strong> Progettato per un montaggio sicuro sul manubrio della tua eBike.</li></ul><h3>Vantaggi</h3><p>L'EBike Display SW102T offre una moltitudine di vantaggi per migliorare la tua esperienza di guida in eBike:</p><ul><li><b>Controllo di guida personalizzato:</b> Adatta la potenza della tua eBike al livello di assistenza desiderato, che tu preferisca un supporto delicato o un'accelerazione potente.</li><li><b>Sicurezza e visibilità migliorate:</b> Lo schermo LCD luminoso garantisce una facile leggibilità in varie condizioni di illuminazione, consentendo una maggiore consapevolezza della situazione durante la guida. corse.</li><li><b>Integrazione perfetta: </b> L'SW102T si integra perfettamente con i motori BAFANG tramite il protocollo UART, garantendo uno scambio di dati fluido e prestazioni affidabili.</li><li><b>Funzionamento intuitivo:</b> L'interfaccia utente intuitiva semplifica la navigazione nei menu e nelle impostazioni, consentendo regolazioni rapide e senza sforzo.</li></ul><h3>Utilizzo</h3><p>L'SW102T è progettato per essere facilmente integrato nella tua eBike con motore BAFANG. È sufficiente montare saldamente il display sul manubrio e collegarlo al motore tramite il cavo UART in dotazione. Utilizza i pulsanti intuitivi sul display per scorrere i menu, regolare i livelli del PAS e monitorare le informazioni di guida essenziali come velocità, livello della batteria e distanza.</p> <p>Controlla regolarmente il livello della batteria della tua eBike e assicurati che la carica sia corretta per ottimizzare le prestazioni. Consulta il manuale utente per istruzioni dettagliate e linee guida di sicurezza specifiche per il tuo sistema motore BAFANG.</p>",/Users/terrybauer/Documents/site affiliation/bafang/APPLI:SCRIPT aliexpress/APP IMPORT ALIEXPRESS/images/1005007958094145/image_1.webp|/Users/terrybauer/Documents/site affiliation/bafang/APPLI:SCRIPT aliexpress/APP IMPORT ALIEXPRESS/images/1005007958094145/image_2.webp|/Users/terrybauer/Documents/site affiliation/bafang/APPLI:SCRIPT aliexpress/APP IMPORT ALIEXPRESS/images/1005007958094145/image_3.webp|/Users/terrybauer/Documents/site affiliation/bafang/APPLI:SCRIPT aliexpress/APP IMPORT ALIEXPRESS/images/1005007958094145/image_4.webp|/Users/terrybauer/Documents/site affiliation/bafang/APPLI:SCRIPT aliexpress/APP IMPORT ALIEXPRESS/images/1005007958094145/image_5.webp|/Users/terrybauer/Documents/site affiliation/bafang/APPLI:SCRIPT aliexpress/APP IMPORT ALIEXPRESS/images/1005007958094145/image_6.webp,BAFANG SW102T LCD Display for BAFANG BBS01B BBS02B BBSHD Mid Drive E Bikes 0-5 Levels PAS UART Protocol,BAFANG SW102T Display LCD per BAFANG BBS01B BBS02B BBSHD Mid Drive E Bikes 0-5 livelli Protocollo PAS UART,"<p>Take control of your eBike journey with the EBike Display SW102T, a sleek and intuitive LCD screen designed specifically for Bafang BBS01B, BBS02B, and BBSHD mid-drive motors. This powerful display seamlessly integrates with your eBike system, providing you with essential ride information at your fingertips.</p><p>The SW102T boasts a user-friendly interface with clear, easy-to-read graphics. Monitor your speed, battery level, mileage, and assist level with effortless clarity. Customize your riding experience by selecting from <strong>0 to 5 levels of pedal assist</strong>, tailoring the power output to your needs. </p><ul><li><strong>Intuitive LCD Display:</strong> Effortlessly monitor your speed, battery level, mileage, and assist level.</li><li><strong>Adjustable Pedal Assist Levels:</strong> Choose from 0 to 5 levels of pedal assist for a customized riding experience.</li><li><strong>Bafang Compatibility:</strong> Designed specifically for Bafang BBS01B, BBS02B, and BBSHD mid-drive motors.</li><li><strong>UART Protocol Support:</strong> Enables seamless communication with your eBike system for optimal performance. </li></ul><p>The SW102T LCD display is more than just a gauge; it's your command center for an enjoyable and efficient eBike ride. </p>","<p>Prendi il controllo del tuo viaggio in eBike con l'EBike Display SW102T, un elegante e intuitivo schermo LCD progettato specificamente per i motori centrali Bafang BBS01B, BBS02B e BBSHD. Questo potente display si integra perfettamente con il tuo sistema eBike, fornendoti informazioni essenziali sulla tua pedalata a portata di mano.</p><p>L'SW102T vanta un'interfaccia intuitiva con una grafica chiara e di facile lettura. Monitora velocità, livello della batteria, chilometraggio e livello di assistenza con la massima chiarezza. Personalizza la tua esperienza di guida selezionando da <strong>0 a 5 livelli di assistenza alla pedalata</strong>, adattando la potenza in base alle tue esigenze. </p><ul><li><strong>Display LCD intuitivo:</strong> monitora senza sforzo velocità, livello della batteria, chilometraggio e livello di assistenza.</li><li><strong>Livelli di assistenza alla pedalata regolabili:</strong> scegli da 0 a 5 livelli di assistenza alla pedalata per un'esperienza di guida personalizzata.</li><li><strong>Compatibilità Bafang:</strong> progettato specificamente per i motori centrali Bafang BBS01B, BBS02B e BBSHD.</li><li><strong>Supporto protocollo UART:</strong> consente una comunicazione fluida con il sistema eBike per prestazioni ottimali. </li></ul><p>Il display LCD SW102T è più di un semplice indicatore; è il tuo centro di comando per una guida eBike piacevole ed efficiente.</p>","BAFANG Ebike Display SW102T LCD Screen, 0-5 Levels","Schermo LCD per display e-bike BAFANG SW102T, livelli 0-5","Upgrade your ebike experience with the SW102T LCD display, featuring 5 PAS levels and a user-friendly interface compatible with BAFANG mid motors for enhanced control and performance.","Migliora la tua esperienza con la bici elettrica con il display LCD SW102T, dotato di 5 livelli PAS e un'interfaccia intuitiva compatibile con i motori centrali BAFANG per un controllo e prestazioni migliorati.",https://www.youtube.com/watch?v=cXtm5NqFKdQ
1005006111093237,1,1,1,Bafang Mid Drive Motor Controller Replacement for BBSHD BBS01B BBS02 BBS02B Motor 48V 750W 52V 1000W 36V 250W 350W 500W,Sostituzione del controller del motore centrale Bafang per BBSHD BBS01B BBS02 BBS02B Motore 48V 750W 52V 1000W 36V 250W 350W 500W,https://s.click.aliexpress.com/e/_c3V8lmCN,"<h3>Features</h3><p>This Bafang mid drive motor controller replacement is designed to seamlessly integrate with your electric bike system. It boasts powerful performance and reliable operation, ensuring a smooth and enjoyable riding experience.</p><ul> <li>Compatible with popular Bafang motors: BBSHD, BBS01B, BBS02, and BBS02B</li> <li>Versatile voltage options: 36V, 48V, and 52V to suit various e-bike configurations</li> <li>Multiple wattage ratings: 250W, 350W, 500W, 750W, and 1000W to cater to different power needs</li> <li>Robust construction for reliable performance and long-lasting durability</li></ul><h3>Specifications</h3><p>Voltage: 36V, 48V, or 52V <br>Wattage: 250W, 350W, 500W, 750W, or 1000W</p><h3>Benefits</h3><p>Experience the power and efficiency of a high-quality Bafang mid drive motor controller. This replacement empowers you with:</p><ul> <li><strong>Increased Power Output:</strong> Enjoy enhanced acceleration and hill-climbing capability.</li> <li>Enhanced Riding Experience: Seamless integration with your Bafang motor for smooth and responsive performance.</li> <li>Reliable Performance: Durable construction ensures consistent operation and longevity.</li></ul><h3>Usage</h3><p>This controller is designed as a direct replacement for compatible Bafang motors. Professional installation is highly recommended to ensure proper functionality and safety. Refer to the manufacturer's instructions for detailed guidance on installation and connection procedures. </p>","<h3>Caratteristiche</h3><p>Questo controller sostitutivo del motore centrale Bafang è progettato per integrarsi perfettamente con il sistema della tua bici elettrica. Offre prestazioni potenti e un funzionamento affidabile, garantendo un'esperienza di guida fluida e piacevole.</p><ul> <li>Compatibile con i motori Bafang più diffusi: BBSHD, BBS01B, BBS02 e BBS02B</li> <li>Opzioni di tensione versatili: 36 V, 48 V e 52 V per adattarsi a varie configurazioni di e-bike</li> <li>Valori di potenza multipli: 250 W, 350 W, 500 W, 750 W e 1000 W per soddisfare diverse esigenze di potenza</li> <li>Costruzione robusta per prestazioni affidabili e lunga durata</li></ul><h3>Specifiche</h3><p>Tensione: 36 V, 48 V o 52 V <br>Potenza: 250 W, 350 W, 500 W, 750 W o 1000W</p><h3>Vantaggi</h3><p>Scopri la potenza e l'efficienza di un controller per motore centrale Bafang di alta qualità. Questo ricambio ti offre:</p><ul> <li><strong>Maggiore potenza in uscita:</strong> goditi un'accelerazione e una capacità di salita migliorate.</li> <li>Esperienza di guida migliorata: integrazione perfetta con il tuo motore Bafang per prestazioni fluide e reattive.</li> <li>Prestazioni affidabili: la struttura durevole garantisce un funzionamento costante e longevità.</li></ul><h3>Utilizzo</h3><p>Questo controller è progettato come ricambio diretto per i motori Bafang compatibili. Si consiglia vivamente l'installazione da parte di un professionista per garantire il corretto funzionamento e la sicurezza. Consultare le istruzioni del produttore per istruzioni dettagliate sulle procedure di installazione e collegamento.</p>",/Users/terrybauer/Documents/site affiliation/bafang/APPLI:SCRIPT aliexpress/APP IMPORT ALIEXPRESS/images/1005006111093237/image_1.webp|/Users/terrybauer/Documents/site affiliation/bafang/APPLI:SCRIPT aliexpress/APP IMPORT ALIEXPRESS/images/1005006111093237/image_2.webp|/Users/terrybauer/Documents/site affiliation/bafang/APPLI:SCRIPT aliexpress/APP IMPORT ALIEXPRESS/images/1005006111093237/image_3.webp|/Users/terrybauer/Documents/site affiliation/bafang/APPLI:SCRIPT aliexpress/APP IMPORT ALIEXPRESS/images/1005006111093237/image_4.webp|/Users/terrybauer/Documents/site affiliation/bafang/APPLI:SCRIPT aliexpress/APP IMPORT ALIEXPRESS/images/1005006111093237/image_5.webp|/Users/terrybauer/Documents/site affiliation/bafang/APPLI:SCRIPT aliexpress/APP IMPORT ALIEXPRESS/images/1005006111093237/image_6.webp,"BAFANG Mid Drive Motor Controller Replacement for BBSHD BBS01B BBS02 BBS02B Motor 48V 750W, 52V 1000W, 36V 250W, 350W, 500W","Sostituzione del controller del motore centrale BAFANG per BBSHD BBS01B BBS02 BBS02B Motore 48V 750W, 52V 1000W, 36V 250W, 350W, 500W","<p>Upgrade your e-bike performance with this Bafang Mid Drive Motor Controller Replacement, designed to seamlessly integrate with popular models like the BBSHD, BBS01B, BBS02, and BBS02B. This powerful controller is available in a range of voltages and wattages to perfectly match your needs, offering options for 36V, 48V, and 52V systems with outputs up to 1000W.</p><p>Experience the benefits of a reliable and efficient mid-drive motor system. This controller provides smooth acceleration, responsive power delivery, and precise control over your e-bike's performance.</p><ul> <li><strong>Compatibility:</strong> Perfectly designed for Bafang BBSHD, BBS01B, BBS02, and BBS02B motors</li> <li><strong>Voltage Options:</strong> Available in 36V, 48V, and 52V systems to match your e-bike configuration</li> <li><strong>Powerful Output:</strong> Choose from a range of wattages up to 1000W for enhanced performance</li> <li><strong>Improved Efficiency:</strong> Experience smooth acceleration, responsive power delivery, and precise control</li></ul><p>Replace your existing controller with confidence and enjoy an elevated e-bike riding experience. This Bafang Mid Drive Motor Controller Replacement is engineered to deliver reliable performance and enhance the overall enjoyment of your electric bike.</p>","<p>Migliora le prestazioni della tua e-bike con questo controller di ricambio per motore centrale Bafang, progettato per integrarsi perfettamente con modelli popolari come BBSHD, BBS01B, BBS02 e BBS02B. Questo potente controller è disponibile in una gamma di tensioni e potenze per soddisfare perfettamente le tue esigenze, offrendo opzioni per sistemi a 36 V, 48 V e 52 V con potenze fino a 1000 W.</p><p>Scopri i vantaggi di un sistema motore centrale affidabile ed efficiente. Questo controller offre un'accelerazione fluida, un'erogazione di potenza reattiva e un controllo preciso sulle prestazioni della tua e-bike.</p><ul> <li><strong>Compatibilità:</strong> Progettato perfettamente per i motori Bafang BBSHD, BBS01B, BBS02 e BBS02B</li> <li><strong>Opzioni di tensione:</strong> Disponibile nei sistemi da 36 V, 48 V e 52 V per adattarsi alla configurazione della tua e-bike</li> <li><strong>Potenza in uscita:</strong> Scegli tra una gamma di potenze fino a 1000 W per prestazioni migliorate</li> <li><strong>Efficienza migliorata:</strong> Prova un'accelerazione fluida, un'erogazione di potenza reattiva e un controllo preciso</li></ul><p>Sostituisci il tuo controller attuale in tutta sicurezza e goditi un'esperienza di guida e-bike superiore. Questo controller sostitutivo per motore centrale Bafang è progettato per offrire prestazioni affidabili e migliorare il divertimento complessivo della tua e-bike.</p>","Replace Bafang Mid Drive Motor Controller (BBSHD, BBS01B)","Sostituisci il controller del motore centrale Bafang (BBSHD, BBS01B)","Upgrade your e-bike performance with this Bafang mid-drive motor controller, offering powerful wattage options and seamless compatibility for various BBS models.","Migliora le prestazioni della tua e-bike con questo controller per motore centrale Bafang, che offre potenti opzioni di potenza e una compatibilità perfetta con vari modelli BBS.",
