product_id,page,category_id,manufacturer_id,titre,titre_it_auto,affiliate_links,description,description_it_auto,image_paths,name,name_it_auto,description_short,description_short_it_auto,meta_title,meta_title_it_auto,meta_description,meta_description_it_auto,youtube_url
1005006913216469,1,1,1,Electric Bike LED Display C961 for BAFANG BBS01B BBS02B BBSHD Mid Drive Motor Bicycle Ebike Computer UART Conversion Kit,Display LED per bici elettrica C961 per motore centrale BAFANG BBS01B BBS02B BBSHD Kit di conversione UART per computer per bicicletta elettrica,https://s.click.aliexpress.com/e/_c3mMghot,"<h3>Features</h3><p>The Electric Bike LED Display C961 is a versatile and user-friendly display designed specifically for BAFANG mid drive motors, including the BBS01B, BBS02B, and BBSHD. This conversion kit allows you to seamlessly integrate an advanced LED display with your existing ebike setup, providing comprehensive information about your ride.</p><ul> <li><strong>LED Display</strong>: A bright and clear LED screen for easy readability in various lighting conditions.</li> <li><strong>UART Conversion Kit</strong>: Enables compatibility with BAFANG mid drive motors through a UART communication protocol.</li> <li><strong>Multi-Functional Interface</strong>: Offers real-time data on speed, distance, battery level, power assist levels, and more.</li></ul><h3>Specifications</h3><p>The C961 display is engineered with precision and attention to detail. </p><ul> <li>Display Type: LED</li> <li>Communication Protocol: UART</li> <li>Compatibility: BAFANG BBS01B, BBS02B, BBSHD Mid Drive Motors</li></ul><h3>Benefits</h3><p>This display kit empowers you with valuable insights into your ebike's performance and battery status. The clear and concise information allows for informed riding decisions, enhancing both safety and efficiency.</p><h3>Usage</h3><p>Installation of the C961 display is relatively straightforward. The UART conversion kit ensures seamless integration with your BAFANG motor. Refer to the included instructions for detailed installation steps. Once installed, you can easily navigate through the display's menu system using intuitive buttons to access various ride data and settings.</em >","<h3>Caratteristiche</h3><p>Il display LED per bici elettrica C961 è un display versatile e intuitivo, progettato specificamente per i motori a trazione centrale BAFANG, inclusi i modelli BBS01B, BBS02B e BBSHD. Questo kit di conversione consente di integrare perfettamente un display LED avanzato con la configurazione della tua e-bike esistente, fornendo informazioni complete sulla tua pedalata.</p><ul> <li><strong>Display LED</strong>: uno schermo LED luminoso e chiaro per una facile leggibilità in diverse condizioni di illuminazione.</li> <li><strong>Kit di conversione UART</strong>: consente la compatibilità con i motori a trazione centrale BAFANG tramite un protocollo di comunicazione UART.</li> <li><strong>Interfaccia multifunzionale</strong>: offre dati in tempo reale su velocità, distanza, livello della batteria, livelli di assistenza alla pedalata e altro ancora.</li></ul><h3>Specifiche</h3><p>Il display C961 è progettato con precisione e attenzione ai dettagli. </p><ul> <li>Tipo di display: LED</li> <li>Protocollo di comunicazione: UART</li> <li>Compatibilità: motori centrali BAFANG BBS01B, BBS02B, BBSHD</li></ul><h3>Vantaggi</h3><p>Questo kit display ti fornisce preziose informazioni sulle prestazioni e sullo stato della batteria della tua e-bike. Le informazioni chiare e concise consentono di prendere decisioni di guida consapevoli, migliorando sia la sicurezza che l'efficienza.</p><h3>Utilizzo</h3><p>L'installazione del display C961 è relativamente semplice. Il kit di conversione UART garantisce una perfetta integrazione con il tuo motore BAFANG. Consulta le istruzioni incluse per i passaggi di installazione dettagliati. Una volta installato, puoi navigare facilmente nel sistema di menu del display utilizzando pulsanti intuitivi per accedere a vari dati e impostazioni di guida.</em >",/Users/terrybauer/Documents/site affiliation/bafang/APPLI:SCRIPT aliexpress/APP IMPORT ALIEXPRESS/images/1005006913216469/image_1.webp|/Users/terrybauer/Documents/site affiliation/bafang/APPLI:SCRIPT aliexpress/APP IMPORT ALIEXPRESS/images/1005006913216469/image_2.webp|/Users/terrybauer/Documents/site affiliation/bafang/APPLI:SCRIPT aliexpress/APP IMPORT ALIEXPRESS/images/1005006913216469/image_3.webp|/Users/terrybauer/Documents/site affiliation/bafang/APPLI:SCRIPT aliexpress/APP IMPORT ALIEXPRESS/images/1005006913216469/image_4.webp|/Users/terrybauer/Documents/site affiliation/bafang/APPLI:SCRIPT aliexpress/APP IMPORT ALIEXPRESS/images/1005006913216469/image_5.webp|/Users/terrybauer/Documents/site affiliation/bafang/APPLI:SCRIPT aliexpress/APP IMPORT ALIEXPRESS/images/1005006913216469/image_6.webp,"BAFANG Electric Bike LED Display C961 for BBS01B, BBS02B, BBSHD Mid Drive Motors - Ebike Computer with UART Conversion Kit","Display LED per bici elettrica BAFANG C961 per motori Mid Drive BBS01B, BBS02B, BBSHD - Computer per bici elettrica con kit di conversione UART","<p>Take control of your electric bike journey with the Electric Bike LED Display C961, designed specifically for BAFANG BBS01B, BBS02B, and BBSHD mid-drive motors. This powerful conversion kit elevates your riding experience by providing a clear, comprehensive view of vital information right at your fingertips.</p><p>The C961 boasts a crisp LED display that illuminates essential data such as speed, odometer, battery level, assist levels, and trip distance. <em>Effortlessly navigate your ride</em> with intuitive controls and real-time feedback, allowing you to optimize performance and conserve energy.</p><ul><li><strong>Integrated UART Connectivity:</strong> Seamlessly connect with various BAFANG motor systems for smooth data transmission and enhanced functionality.</li><li>High-visibility LED Display: Enjoy clear readability in diverse lighting conditions.</li><li>Intuitive Controls: Navigate menus and adjust settings with ease.</li><li>Comprehensive Data Insights: Track speed, distance, battery level, assist levels, and more.</li></ul> <p>Upgrade your electric bike today and unlock a world of possibilities with the Electric Bike LED Display C961. </p>","<p>Prendi il controllo del tuo viaggio in bici elettrica con il display LED per bici elettrica C961, progettato specificamente per i motori centrali BAFANG BBS01B, BBS02B e BBSHD. Questo potente kit di conversione migliora la tua esperienza di guida offrendo una visualizzazione chiara e completa di informazioni vitali a portata di mano.</p><p>Il C961 vanta un nitido display LED che illumina i dati essenziali come velocità, contachilometri, livello della batteria, livelli di assistenza e distanza percorsa. <em>Guida senza sforzo la tua bici</em> con comandi intuitivi e feedback in tempo reale, che ti consentono di ottimizzare le prestazioni e risparmiare energia.</p><ul><li><strong>Connettività UART integrata:</strong> connettiti senza problemi con vari sistemi motore BAFANG per una trasmissione dati fluida e funzionalità avanzate.</li><li>Display LED ad alta visibilità: goditi una chiara leggibilità in diverse condizioni di illuminazione.</li><li>Comandi intuitivi: naviga nei menu e regola le impostazioni con facilità.</li><li>Approfondimenti completi sui dati: monitora velocità, distanza, livello della batteria, livelli di assistenza e altro ancora.</li></ul> <p>Aggiorna la tua bici elettrica oggi stesso e scopri un mondo di possibilità con il display LED per bici elettrica C961.</p>",BAFANG Ebike LED Display C961: Upgrade Your Electric Bike,Display LED per bici elettrica BAFANG C961: migliora la tua bici elettrica,"Enhance your e-bike experience with the C961 display, offering speed, distance, battery level, and more, seamlessly integrating with BAFANG mid drive motors.","Migliora la tua esperienza con la bici elettrica con il display C961, che fornisce informazioni su velocità, distanza, livello della batteria e molto altro, integrandosi perfettamente con i motori centrali BAFANG.",
1005006115116374,1,1,1,Twist Throttle Speed Throttle Grip for Bafang 3 Pin BBS01B BBS02B BBSHD Mid Drive Motor Conversion Kits E-Bike Throttle Wit,"Acceleratore a rotazione per acceleratore a manopola per Bafang BBS01B BBS02B BBSHD a 3 pin, kit di conversione per motore centrale, acceleratore per bici elettrica",https://s.click.aliexpress.com/e/_c3etoHz3,"<h3>Features</h3><p>This Twist Throttle Speed Throttle Grip is designed specifically for Bafang 3-Pin BBS01B, BBS02B, and BBSHD mid-drive motor conversion kits. It provides seamless control over your e-bike's speed with a simple twist motion.</p><ul> <li><strong>Twist Throttle Design:</strong> For intuitive and responsive acceleration control.</li> <li>Compatible with Bafang 3-Pin Connectors:</li> Ensures a secure and reliable connection to your motor.</li> <li>Durable Construction: </li>Built to withstand the demands of regular use.</li></ul><h3>Specifications</h3><p>This throttle grip is engineered for optimal performance and compatibility with your Bafang motor conversion kit. </p><h3>Benefits</h3><p>Experience the freedom and convenience of effortless speed control with this twist throttle grip. The intuitive design allows you to effortlessly adjust your e-bike's speed, making it perfect for navigating various terrains and riding conditions.</p><h3>Usage</h3><p>Simply connect the throttle grip to your Bafang 3-Pin motor connector according to the instructions provided. Then, twist the grip in the desired direction to accelerate or decelerate. The smooth and responsive nature of the twist throttle allows for precise control over your e-bike's speed.</p>","<h3>Caratteristiche</h3><p>Questa manopola dell'acceleratore a rotazione è progettata specificamente per i kit di conversione del motore centrale Bafang a 3 pin BBS01B, BBS02B e BBSHD. Offre un controllo continuo della velocità della tua e-bike con un semplice movimento di rotazione.</p><ul> <li><strong>Design dell'acceleratore a rotazione:</strong> per un controllo dell'accelerazione intuitivo e reattivo.</li> <li>Compatibile con i connettori Bafang a 3 pin:</li> garantisce una connessione sicura e affidabile al tuo motore.</li> <li>Costruzione durevole:</li> costruita per resistere alle esigenze di un uso regolare.</li></ul><h3>Specifiche</h3><p>Questa manopola dell'acceleratore è progettata per prestazioni ottimali e compatibilità con il tuo kit di conversione del motore Bafang.</p><h3>Vantaggi</h3><p>Scopri la libertà e la praticità di un controllo della velocità senza sforzo con questa manopola dell'acceleratore a rotazione. Il design intuitivo consente di regolare senza sforzo la velocità della tua e-bike, rendendola perfetta per affrontare diversi terreni e condizioni di guida.</p><h3>Utilizzo</h3><p>Basta collegare la manopola dell'acceleratore al connettore del motore Bafang a 3 pin seguendo le istruzioni fornite. Quindi, ruotare la manopola nella direzione desiderata per accelerare o decelerare. La natura fluida e reattiva della manopola dell'acceleratore consente un controllo preciso della velocità della tua e-bike.</p>",/Users/terrybauer/Documents/site affiliation/bafang/APPLI:SCRIPT aliexpress/APP IMPORT ALIEXPRESS/images/1005006115116374/image_1.webp|/Users/terrybauer/Documents/site affiliation/bafang/APPLI:SCRIPT aliexpress/APP IMPORT ALIEXPRESS/images/1005006115116374/image_2.webp|/Users/terrybauer/Documents/site affiliation/bafang/APPLI:SCRIPT aliexpress/APP IMPORT ALIEXPRESS/images/1005006115116374/image_3.webp|/Users/terrybauer/Documents/site affiliation/bafang/APPLI:SCRIPT aliexpress/APP IMPORT ALIEXPRESS/images/1005006115116374/image_4.webp|/Users/terrybauer/Documents/site affiliation/bafang/APPLI:SCRIPT aliexpress/APP IMPORT ALIEXPRESS/images/1005006115116374/image_5.webp|/Users/terrybauer/Documents/site affiliation/bafang/APPLI:SCRIPT aliexpress/APP IMPORT ALIEXPRESS/images/1005006115116374/image_6.webp,"BAFANG Twist Throttle Speed Controller for BBS01B, BBS02B, BBSHD Mid Drive Motors (E-Bike Conversion Kits)","Regolatore di velocità dell'acceleratore a torsione BAFANG per motori centrali BBS01B, BBS02B, BBSHD (kit di conversione per bici elettriche)","<p>Take control of your e-bike's power with the Twist Throttle Speed Throttle Grip. Designed specifically for Bafang 3 Pin BBS01B, BBS02B, and BBSHD mid-drive motor conversion kits, this throttle gives you precise speed control at your fingertips.</p><p>Twisting the grip smoothly adjusts your e-bike's speed, allowing for a seamless and enjoyable riding experience. Whether you're cruising on flat roads or tackling challenging hills, the Twist Throttle Speed Throttle Grip provides the perfect level of control.</p><ul><li><strong>Compatible with Bafang 3 Pin BBS01B, BBS02B, and BBSHD mid-drive motors</strong></li><li>Twist throttle design for smooth and precise speed control</li><li>Easy installation and integration into your e-bike setup</li><li>Durable construction for long-lasting performance</li></ul> <p>Experience the freedom and efficiency of an e-bike with the Twist Throttle Speed Throttle Grip. Enhance your riding experience and enjoy effortless acceleration with every twist.</p>","<p>Prendi il controllo della potenza della tua e-bike con la manopola acceleratore Twist Throttle Speed. Progettata specificamente per i kit di conversione motore centrale Bafang 3 Pin BBS01B, BBS02B e BBSHD, questa manopola ti offre un controllo preciso della velocità a portata di mano.</p><p>Ruotando la manopola puoi regolare la velocità della tua e-bike in modo fluido e piacevole. Che tu stia percorrendo strade pianeggianti o affrontando salite impegnative, la manopola dell'acceleratore Twist Throttle Speed ​​offre il livello di controllo perfetto.</p><ul><li><strong>Compatibile con i motori centrali Bafang 3 Pin BBS01B, BBS02B e BBSHD</strong></li><li>Design dell'acceleratore Twist per un controllo della velocità fluido e preciso</li><li>Facile installazione e integrazione nella configurazione della tua e-bike</li><li>Costruzione resistente per prestazioni durature</li></ul> <p>Sperimenta la libertà e l'efficienza di una e-bike con la manopola dell'acceleratore Twist Throttle Speed. Migliora la tua esperienza di guida e goditi un'accelerazione senza sforzo a ogni torsione.</p>",Bafang Twist Throttle: Speed & Control for E-Bikes (BBS01B/BBSHD),Bafang Twist Throttle: velocità e controllo per bici elettriche (BBS01B/BBSHD),"Enhance your e-bike's performance with this Twist Throttle Grip, designed specifically for Bafang mid-drive motors like the BBS01B, BBS02B, and BBSHD for seamless speed control.","Migliora le prestazioni della tua e-bike con questa manopola acceleratore girevole, progettata specificamente per i motori centrali Bafang come BBS01B, BBS02B e BBSHD, per un controllo della velocità senza interruzioni.",
1005006119862540,1,1,1,Wuxing Waterproof Brake Lever for Bafang  BBS01B  BBS02B BBSHD Mid Drive Motor Replacement Ebike Cut Off Power Brake Levers,"Leva freno impermeabile Wuxing per Bafang BBS01B BBS02B BBSHD, sostituzione del motore centrale, leve freno di potenza per bici elettrica",https://s.click.aliexpress.com/e/_c3MTDhNF,"<h3>Features</h3><p>This Wuxing Waterproof Brake Lever is designed specifically for Bafang BBS01B, BBS02B, and BBSHD mid-drive motor eBikes. It seamlessly integrates with your existing braking system to provide a safe and reliable cutoff power feature.</p><ul> <li><strong>Waterproof Design:</strong> Withstands the elements and ensures consistent performance in various weather conditions.</li> <li>Precise Braking Action: Delivers smooth and responsive braking control for enhanced safety.</li> <li>Easy Installation: Designed for straightforward integration with your eBike's existing brake system.</li></ul><h3>Specifications</h3><p>This product is designed to work seamlessly with Bafang BBS01B, BBS02B, and BBSHD mid-drive motor eBikes. It features a robust construction that can withstand the rigors of regular use.</p><h3>Benefits</h3><p>The Wuxing Waterproof Brake Lever offers several significant benefits for eBike riders:</p><ul> <li><strong>Enhanced Safety:</strong> Automatically cuts power to the motor when the brakes are engaged, preventing unintended acceleration and enhancing overall safety.</li> <li>Increased Control: Provides a reliable and responsive braking system for confident handling in various riding situations.</li> <li>Weather Resistance: The waterproof design ensures consistent performance regardless of the weather conditions.</li></ul><h3>Usage</h3><p>To use this brake lever, simply install it according to the provided instructions. When you apply the brakes, the motor power will automatically cut off. Release the brakes, and the motor will resume operation. This seamless integration ensures a safe and controlled riding experience.</p>","<h3>Caratteristiche</h3><p>Questa leva freno impermeabile Wuxing è progettata specificamente per le eBike con motore centrale Bafang BBS01B, BBS02B e BBSHD. Si integra perfettamente con il sistema frenante esistente per fornire una funzione di interruzione della potenza sicura e affidabile.</p><ul> <li><strong>Design impermeabile:</strong> resiste agli elementi e garantisce prestazioni costanti in diverse condizioni atmosferiche.</li> <li>Azione frenante precisa: offre un controllo della frenata fluido e reattivo per una maggiore sicurezza.</li> <li>Installazione semplice: progettata per una semplice integrazione con il sistema frenante esistente della tua eBike.</li></ul><h3>Specifiche</h3><p>Questo prodotto è progettato per funzionare perfettamente con le eBike con motore centrale Bafang BBS01B, BBS02B e BBSHD. Presenta una struttura robusta in grado di resistere ai rigori dell'uso regolare.</p><h3>Vantaggi</h3><p>La leva freno impermeabile Wuxing offre diversi vantaggi significativi per i ciclisti di eBike:</p><ul> <li><strong>Maggiore sicurezza:</strong> interrompe automaticamente l'alimentazione al motore quando i freni sono azionati, prevenendo accelerazioni involontarie e migliorando la sicurezza generale.</li> <li>Maggiore controllo: fornisce un sistema frenante affidabile e reattivo per una maneggevolezza sicura in diverse situazioni di guida.</li> <li>Resistenza alle intemperie: il design impermeabile garantisce prestazioni costanti indipendentemente dalle condizioni meteorologiche.</li></ul><h3>Utilizzo</h3><p>Per utilizzare questa leva freno, è sufficiente installarla secondo le istruzioni fornite. Quando si azionano i freni, la potenza del motore si interrompe automaticamente. Rilasciando i freni, il motore riprenderà a funzionare. Questa perfetta integrazione garantisce un'esperienza di guida sicura e controllata.</p>",/Users/terrybauer/Documents/site affiliation/bafang/APPLI:SCRIPT aliexpress/APP IMPORT ALIEXPRESS/images/1005006119862540/image_1.webp|/Users/terrybauer/Documents/site affiliation/bafang/APPLI:SCRIPT aliexpress/APP IMPORT ALIEXPRESS/images/1005006119862540/image_2.webp|/Users/terrybauer/Documents/site affiliation/bafang/APPLI:SCRIPT aliexpress/APP IMPORT ALIEXPRESS/images/1005006119862540/image_3.webp|/Users/terrybauer/Documents/site affiliation/bafang/APPLI:SCRIPT aliexpress/APP IMPORT ALIEXPRESS/images/1005006119862540/image_4.webp|/Users/terrybauer/Documents/site affiliation/bafang/APPLI:SCRIPT aliexpress/APP IMPORT ALIEXPRESS/images/1005006119862540/image_5.webp|/Users/terrybauer/Documents/site affiliation/bafang/APPLI:SCRIPT aliexpress/APP IMPORT ALIEXPRESS/images/1005006119862540/image_6.webp,"BAFANG Waterproof Brake Lever for BBS01B, BBS02B, and BBSHD Mid Drive Motors - E-Bike Power Cut Off Brake Levers","Leva freno impermeabile BAFANG per motori centrali BBS01B, BBS02B e BBSHD - Leve freno con interruzione di corrente per bici elettriche","<p>Tired of dealing with pesky brake levers that fail you when you need them most? Upgrade your e-bike experience with the Wuxing Waterproof Brake Lever, specifically designed for Bafang BBS01B, BBS02B, and BBSHD mid drive motors. </p><p>This isn't just any brake lever; it's engineered to withstand the elements with its robust waterproof design. Whether you're conquering muddy trails or braving a sudden downpour, you can rely on this lever to perform flawlessly. </p><ul><li><strong>Waterproof Construction:</strong> Ride confidently in any weather conditions.</li><li>Designed for Bafang BBS01B, BBS02B, and BBSHD Motors: Seamless compatibility for your e-bike setup.</li><li><strong>Power Cut-Off Function: </strong> Ensures safety by automatically disengaging power when you brake.</li></ul><p>The Wuxing Waterproof Brake Lever provides a secure grip and precise braking control, giving you the peace of mind to focus on your ride. Experience enhanced safety and reliability with every pedal stroke.</p>","<p>Stanco di avere a che fare con fastidiose leve dei freni che ti abbandonano quando ne hai più bisogno? Migliora la tua esperienza in e-bike con la leva freno impermeabile Wuxing, progettata specificamente per i motori centrali Bafang BBS01B, BBS02B e BBSHD. </p><p>Questa non è una leva freno qualsiasi; è progettata per resistere agli elementi grazie al suo robusto design impermeabile. Che tu stia affrontando sentieri fangosi o sfidando un acquazzone improvviso, puoi contare su questa leva per prestazioni impeccabili. </p><ul><li><strong>Struttura impermeabile:</strong> guida in sicurezza in qualsiasi condizione atmosferica.</li><li>Progettato per motori Bafang BBS01B, BBS02B e BBSHD: compatibilità perfetta con la tua configurazione e-bike.</li><li><strong>Funzione di interruzione di potenza:</strong> garantisce la sicurezza disinserendo automaticamente la potenza in frenata.</li></ul><p>La leva del freno impermeabile Wuxing offre una presa sicura e un controllo preciso della frenata, dandoti la tranquillità di concentrarti sulla tua guida. Sperimenta maggiore sicurezza e affidabilità a ogni pedalata.</p>",Waterproof Brake Levers for Bafang BBS01B/BBS02B Motors,Leve freno impermeabili per motori Bafang BBS01B/BBS02B,"Enhance your e-bike safety and control with our waterproof brake levers designed specifically for Bafang BBS01B, BBS02B, and BBSHD mid drive motors.","Migliora la sicurezza e il controllo della tua e-bike con le nostre leve freno impermeabili progettate specificamente per i motori centrali Bafang BBS01B, BBS02B e BBSHD.",
